CTR20230454,进行中,进行中（尚未招募）,朱小珊,武汉九珑人福药业有限责任公司,2023-02-16,,黄体酮软胶囊,,化学药物,,用于治疗由黄体酮缺乏引起的机能障碍：排卵机能障碍引起的月经失调；痛经及经前期综合征；出血（由纤维瘤所致）；绝经前紊乱；绝经（用于补充雌激素治疗）。也助于妊娠。,其它其他说明:生物等效性试验,,生物等效性试验/生物利用度试验,国内试验,45岁(最小年龄)至65岁(最大年龄),女,国内:45；,国内:登记人暂未填写该信息；,国内:登记人暂未填写该信息；,1受试者试验前签署知情同意书、并对试验内容、过程及可能出现的不良反应充分了解；自愿参加且能够按照试验方案要求完成研究；2年龄为45~65周岁（包括边界值）的健康自然绝经后女性受试者，停经至少12个月以上；3体重≥45.0kg；体重指数（BMI）在19.0~28.0kg/m2范围内（包括临界值）。,1有临床表现异常需排除的疾病，包括但不限于神经系统、心血管系统、血液和淋巴系统、免疫系统、泌尿系统、消化系统、呼吸系统、代谢及骨骼等系统疾病者；2患有凝血功能障碍或任何增加出血性风险的疾病，如急性胃炎或胃及十二指肠溃疡者；3有血栓性静脉炎、静脉血栓栓塞、冠状动脉疾病、缺血性中风或有既往病史者；4存在有可能显著影响药物吸收、分布、代谢和排泄的疾病、与试验用药品作用有关的病史及其他任何情况者；5子宫内膜增厚（厚度≥5mm）、子宫内膜肿瘤、子宫肌瘤（大小≥3cm）、乳腺癌或卵巢癌者，且经研究者判定不适宜参加的受试者；6绝经后阴道不明原因出血者；7既往有重大疾病史者；8筛选前3个月内接受过手术，或者计划在研究期间进行手术者，及凡接受过会影响药物吸收、分布、代谢、排泄的手术者；9筛选前3个月内服用过雌激素类药物者；10筛选前2周内使用过影响药物吸收、代谢的任何处方药、非处方药、中草药和维生素者；11筛选前4周内使用了任何改变肝药酶活性的药物（如：诱导剂—巴比妥类、抗癫痫药（卡马西平、苯妥英钠）、利福平、保泰松、溴隐亭、螺内酯，灰黄霉素、奥美拉唑、氨鲁米特、抗生素（氨苄青霉素，四环素）以及含圣约翰草（贯叶连翘）的草药；抑制剂—酮康唑、伊曲康唑、西咪替丁、地尔硫卓、利托那韦、奈非那韦、维拉帕米）者；12筛选前6个月内有药物滥用史者，筛选前3个月内使用过毒品者；13对黄体酮或任一药物组分有过敏史者；曾出现对两种或两种以上药物、食物等过敏者；14筛选前4周内接种过疫苗者或计划在试验期间接种疫苗者；15筛选前3个月内献血包括成分血或失血（≥200mL），接受输血或使用血制品者；16筛选前3个月内入组过其他的药物或器械临床试验者；17不能耐受静脉穿刺者，有晕针晕血史者；18有吞咽困难者；19筛选前3个月内平均每天吸烟量大于5支，或试验期间不能停止使用任何烟草类产品者；20筛选前3个月内平均每周饮酒量大于14单位（1单位=17.7mL乙醇，即1单位=357mL酒精量为5%的啤酒或43mL酒精量为40%的白酒或147mL酒精量为12%的葡萄酒），或试验期间不能禁酒者；21筛选前3个月内平均每天饮用过量茶、咖啡和/或含咖啡因的饮料（平均8杯以上，1杯≈250mL）者；22筛选前3天内食用过特殊饮食（包括奶制品、豆制品等含内源性黄体酮的食物，或含火龙果、芒果、酸橙、柚子、杨桃等可能影响药物代谢酶的水果或相应果汁）者，或其他影响药物吸收、分布、代谢、排泄的特殊饮食者；23对饮食有特殊要求，不能接受统一饮食者；24体格检查、生命体征、12-导联心电图、实验室检查[血生化、血常规、尿常规、凝血功能、免疫十项、性激素六项（卵泡刺激素—FSH≤40IU/L，雌二醇水平≥40pg/mL或146.8pmol/L）、烟检、血液酒精及药物滥用检查]、经阴道B超、乳腺彩超检查，结果显示异常有临床意义者；25其他研究者判定不适宜参加的受试者。,国内：登记人暂未填写该信息；,国内：登记人暂未填写该信息；,国内：登记人暂未填写该信息；,"主要目的：以武汉九珑人福药业有限责任公司提供，授权人福普克药业（武汉）有限公司生产的黄体酮软胶囊（规格：0.2g）为受试制剂，以持证商为BesinsHealthcareBenelux、生产厂家为CyndeaPharma,S.L.的黄体酮软胶囊（商品名：安琪坦®，规格：0.2g）为参比制剂，按生物等效性试验的相关规定，比较黄体酮软胶囊在健康绝经后女性受试者体内空腹状态下的药代动力学特征，评价两种制剂的生物等效性。次要目的：评价健康绝经后女性受试者单次空腹口服黄体酮软胶囊受试制剂和参比制剂后的安全性。",黄体酮软胶囊在健康绝经后女性受试者中单中心、随机、开放、单次给药、两制剂、三周期、部分重复交叉设计空腹状态下的生物等效性试验,黄体酮软胶囊空腹生物等效性试验,1中文通用名:黄体酮软胶囊英文通用名:ProgesteroneSoftCapsules商品:NA剂型:软胶囊规格:0.2g用量:口服，每次1粒用药时程:空腹状态下，每周期单次给药，共给药1次。,1中文通用名:黄体酮软胶囊英文通用名:ProgesteroneSoftCapsules商品:安琪坦®剂型:软胶囊规格:0.2g用量:口服，每次1粒用药时程:空腹状态下，每周期单次给药，共给药2次。,RFYY-HTTJ-B02,,,2022-11-07,否,交叉设计,随机化,开放,有,无,有,国内试验
CTR20230445,进行中,进行中（尚未招募）,银礼特,广州朗圣药业有限公司,2023-02-15,,利丙双卡因乳膏,/,化学药物,,用于：1）皮肤穿刺（如置入导管或取血样本）；2）浅层外科手术（如生殖器黏膜的浅层外科手术或浸润麻醉之前、腿部溃疡清创术）,其它其他说明:生物等效性试验,,生物等效性试验/生物利用度试验,国内试验,18岁(最小年龄)至无上限(最大年龄),男+女,国内:34；,国内:登记人暂未填写该信息；,国内:登记人暂未填写该信息；,1年龄在18周岁以上（含18周岁）的中国健康受试者，男女均可；2男性受试者体重不小于50kg，女性受试者体重不小于45kg；体重指数在19.0~26.0kg/m2范围内（包括临界值）（体重指数（BMI）＝体重（kg）/身高2（m2））；3试验前签署知情同意书、并对试验内容、过程及可能出现的不良反应充分了解；4受试者能够和研究者进行良好的沟通，并且理解和遵守本项研究的各项要求者。,1试验前3个月内参加了任何药物临床试验者或使用研究药物者；（问诊+联网筛查）2对利多卡因、丙胺卡因等酰胺类局部麻醉药、本品中任何辅料或医用胶带过敏者，或对两种或两种以上药物（或食物）过敏者；（问诊）3患有研究者判断为有临床意义的皮肤疾病（如：湿疹、荨麻疹、特异性皮炎等）者或给药部位（双侧大腿前侧皮肤）有胎记、疤痕、纹身，开放性伤口者或毛发旺盛者；（问诊）4既往存在或现有葡萄糖-6-磷酸脱氢酶缺乏症、高铁血红蛋白血症者；（问诊）5有心血管系统、内分泌系统、泌尿系统、神经系统、血液学、免疫学（包括个人或家族史遗传性免疫缺陷）、代谢异常等病史且研究者认为目前仍有临床意义者；（问诊）6不能耐受静脉穿剌或有晕血、晕针史者；（问诊）7试验前6个月内接受过经研究者判断会影响药物吸收、分布、代谢、排泄的手术者；或试验前4周内接受过外科手术；或计划在研究期间进行外科手术者；（问诊）8筛选前4周内使用过任何与利多卡因、丙胺卡因有相互作用的药物（如III类抗心律失常药（胺碘酮）、西咪替丁或β受体阻滞剂等）或与高铁血红蛋白诱导药物有关的药物（如磺酰胺、硝基呋喃妥因、苯妥英钠、苯巴比妥等）者或筛选前4周内双侧大腿前侧皮肤使用了外用皮肤科药物治疗者；（问诊）9试验前14天内使用过任何药物（包括中草药、保健品等）者；（问诊）10试验前14天内接种过疫苗（包括减毒活疫苗），或计划会在试验期间接种疫苗者；（问诊）11试验前3个月内献血或大量失血（>400mL，女性生理期除外）者，接受输血或使用血制品者，或打算在试验期间或试验结束后3个月内献血或血液成份者；（问诊）12药物滥用者或试验前1年内使用过软毒品（如：大麻）或硬毒品（如苯环己哌啶等）者；（问诊）13试验前3个月内每日吸烟量多于5支者，或试验期间不能停止使用任何烟草类产品者；（问诊）14试验前6个月内经常饮酒者，即每周饮酒超过14单位酒精（1单位=360mL啤酒或45mL酒精量为40%的烈酒或150mL葡萄酒）；或试验期间不愿意停止饮酒或任何含酒精的制品者；（问诊）15每天饮用过量茶、咖啡和/或含咖啡因的饮料（8杯以上，1杯=250mL）者，或不同意试验期间停止饮用茶、咖啡和/或含咖啡因的饮料者；（问诊）16在使用研究药物前7天内进食可能影响药物体内代谢的饮食（包括葡萄柚或葡萄柚产品、柚子、橘子、甘蓝类蔬菜），或研究者认为有其他影响药物吸收、分布、代谢、排泄的饮食者，或不同意试验期间停止进食上述饮食者；（问诊）17对饮食有特殊要求，不能遵守统一饮食者，或对乳糖不耐受者；（问诊）18筛选前2周内发生非保护性性行为，男性受试者（或其伴侣）或女性受试者试验期间至试验结束后3个月内有妊娠计划、捐精捐卵计划，或试验期间不愿采取一种或一种以上的非药物避孕措施（如完全禁欲、避孕环、伴侣结扎等）者；（问诊）19妊娠期或哺乳期女性；（问诊）20皮肤划痕试验阳性者；21试验前生命体征检查异常且有临床意义者，由研究者参考正常范围后综合判定；22试验前体格检查异常且有临床意义者；23试验前实验室检查异常且有临床意义者；24试验前心电图异常且有临床意义者；25受试者可能因为其他原因而不能完成本研究或经研究者判断具有其它不宜参加试验原因者。,国内：登记人暂未填写该信息；,国内：登记人暂未填写该信息；,国内：登记人暂未填写该信息；,采用单中心、随机、开放、双周期交叉、空腹试验设计比较健康受试者单次使用广州朗圣药业有限公司提供的利丙双卡因乳膏（规格：20g（1g：利多卡因25mg，丙胺卡因25mg））与AspenPharmaTradingLimited持证的利丙双卡因乳膏（商品名：EMLA®，规格：30g（1g：利多卡因25mg，丙胺卡因25mg））在中国健康人群中吸收程度和吸收速度的差异，并评价两制剂的安全性。,利丙双卡因乳膏（1g：利多卡因25mg，丙胺卡因25mg）在中国健康受试者中单中心、随机、开放、单剂量、两周期交叉空腹及餐后状态下的生物等效性试验,利丙双卡因乳膏人体生物等效性研究,1中文通用名:利丙双卡因乳膏英文通用名:LidocainePrilocaineCream商品:NA剂型:乳膏剂规格:1g：利多卡因25mg，丙胺卡因25mg，20g/支用量:60g，将本品均匀涂抹在大腿前侧400cm2无损伤的皮肤上（每条腿各涂抹30g）用药时程:单次给药,1中文通用名:利丙双卡因乳膏英文通用名:LidocainePrilocaineCream商品:EMLA®剂型:乳膏剂规格:1g：利多卡因25mg，丙胺卡因25mg，30g/支用量:60g，将本品均匀涂抹在大腿前侧400cm2无损伤的皮肤上（每条腿各涂抹30g）用药时程:单次给药,JY-BE-LBSKY-2022-03,,,2022-12-05,否,交叉设计,随机化,开放,有,无,有,国内试验
CTR20230438,进行中,进行中（尚未招募）,赵丹,维眸生物科技（上海）有限公司,2023-02-16,,VVN461滴眼液,,化学药物,企业选择不公示,非感染性前葡萄膜炎,I期,,安全性,国内试验,18岁(最小年龄)至50岁(最大年龄),男+女,国内:30；,国内:登记人暂未填写该信息；,国内:登记人暂未填写该信息；,1对本研究已充分理解并遵守研究流程，自愿参加并签署知情同意书者；2年龄在18-50岁（包含两端界值）的健康成年人，男女不限（以签署知情同意书当天为准）；3男性体重≥50.0kg，女性体重≥45.0kg；且体重指数（BMI=体重/身高平方）在19-26kg/m2（包括临界值）；4双眼最佳矫正视力（BCVA）均应≥0.8（标准对数视力表）；双眼眼内压应在11-21mmHg（包括临界值）；裂隙灯眼前节检查和眼底检查（眼底照相）未见明显异常者，或经研究者判断检查异常为无临床意义；5无心、肝、肾、消化道、神经系统、呼吸系统（例如哮喘、运动诱导的哮喘、慢性阻塞性肺病）、血液和淋巴系统、骨骼肌肉系统、风湿免疫、精神异常及代谢异常等有临床意义的病史；6试验前体格检查、生命体征、12导联心电图和实验室检查结果均在正常值范围内或者异常无临床意义；7育龄期女性尿妊娠试验阴性。受试者保证筛选前1个月内采取有效避孕措施，且受试者及其配偶在试验期间和末次给药结束后6个月内无生育、捐精或卵子计划，并且自愿采取有效避孕措施。,1已知对研究药物或其成分过敏者或存在禁忌症者；2任一眼有解剖结构异常或独眼者；3任一眼有眼部手术史（眼睑整形术除外）或者眼部激光治疗史（包括角膜屈光手术史）者；4筛选前3个月内，任一眼接受过眼睑整形术者；5任一眼有脉络膜下腔注射或者玻璃体腔注射史者；6筛选前3个月内，任一眼有感染性眼病、免疫性眼病、炎症性眼病或者眼外伤者；7筛选前1个月内，任一眼使用过局部眼用药物（包括人工泪液、中成药滴眼液和OTC眼用药物）；8筛选前14天内，任一眼使用过角膜接触镜，且整个研究期间不能停用角膜接触镜者；9任一眼有青光眼、角膜混浊、角膜变性、角膜营养不良、葡萄膜炎、眼底病变等眼科疾病病史，经研究者评估不宜参加该试验者；10筛选前一个月内有感染性疾病（经研究者判断会影响受试者参与试验的能力）、严重外伤或3个月内有外科大手术史者；11伴有具有临床意义的食物、药物过敏史，或者特异性变态反应性疾病病史（哮喘、荨麻疹、湿疹等）；12筛选前3个月内使用过全身使用过免疫抑制剂、抗风湿性药物或者皮质类固醇激素者；13乙型肝炎病毒表面抗原阳性、丙型肝炎病毒抗体阳性、人类免疫缺陷病毒抗体阳性、梅毒抗体阳性者；14药物滥用者、尿液药物筛查检测阳性者或吸毒者；15嗜烟者（最近3个月每天吸烟达5支及以上或等量烟草）或筛选时尿液尼古丁检测阳性者；16嗜酒者（最近3个月每周饮酒14单位以上，每单位相当于360mL啤酒或150mL葡萄酒或45mL酒精含量为40%的烈酒），或在入院时酒精呼气检测结果为阳性者；17筛选前3个月内或者5倍消除半衰期内（以两者时间较长者为准），参加过任何药物或医疗器械临床试验者；18筛选前3个月内献血或失血≥400mL，或接受过输血；或筛选前1个月内献血或失血≥200mL者；19不能耐受静脉穿刺采血或既往有晕针、晕血病史者或者患有体位性低血压晕厥者；20筛选前1个月内有疫苗接种史者；21筛选前2周内服过任何处方药物、中草药、非处方药、或者膳食补充品（保健品）者；22在服用研究药物前48小时内摄取了巧克力、任何含咖啡因或富含黄嘌呤食物或饮料；23在给药前的2周或者5倍消除半衰期内（以两者时间较长者为准）接受过任何药物，包括草药和膳食补充者；24筛选时伴精神病类疾病或心理性疾病者；25试验期间对饮食有特殊要求，不能接受统一饮食者；26Covid-19核酸检测阳性者；27妊娠或哺乳期女性，或妊娠试验阳性者；28根据研究者判断任何不宜参加此试验的受试者。,国内：登记人暂未填写该信息；,国内：登记人暂未填写该信息；,国内：登记人暂未填写该信息；,主要目的：评价单次及多剂给药的0.25%、0.5%和1.0%VVN461滴眼液在健康成年受试者中的安全性和耐受性。次要目的：评价0.25%、0.5%和1.0%VVN461滴眼液在健康成年受试者中可检测到的血药浓度；若检测到足够数量的系统暴露量，评价0.25%、0.5%和1.0%VVN461滴眼液在健康成年受试者中的药代动力学（PK）。,一项评价0.25%、0.5%和1.0%VVN461滴眼液在健康成年受试者中的安全性、耐受性和药代动力学的随机、双盲、溶媒对照、剂量爬坡、单中心的I期临床试验,VVN461滴眼液在健康成年受试者中的安全性、耐受性和药代动力学的I期试验,1中文通用名:VVN461滴眼液英文通用名:VVN461OphthalmicSolution商品:NA剂型:滴眼剂规格:0.25%（0.4ml:1.0mg)用量:单次：右眼滴入一滴多剂QID和Q2h：每次右眼滴入一滴，每日4次（间隔3小时）、6次（间隔2小时）用药时程:单次给药（D1）、每日4次给药（D2至D5）、每日6次给药（D6至D9），其中D2至D4期间每天给药4次（两次给药间隔3小时）、D5的早晨右眼给药1次，D6至D8期间每天给药6次（两次给药间隔2小时）、D9的早晨右眼给药1次。2中文通用名:VVN461滴眼液英文通用名:VVN461OphthalmicSolution商品:NA剂型:滴眼剂规格:0.5%（0.4ml:2.0mg)用量:单次：右眼滴入一滴多剂QID和Q2h：每次右眼滴入一滴，每日4次（间隔3小时）、6次（间隔2小时）用药时程:单次给药（D1）、每日4次给药（D2至D5）、每日6次给药（D6至D9），其中D2至D4期间每天给药4次（两次给药间隔3小时）、D5的早晨右眼给药1次，D6至D8期间每天给药6次（两次给药间隔2小时）、D9的早晨右眼给药1次。3中文通用名:VVN461滴眼液英文通用名:VVN461OphthalmicSolution商品:NA剂型:滴眼剂规格:1%（0.4ml:4.0mg)用量:单次：右眼滴入一滴多剂QID和Q2h：每次右眼滴入一滴，每日4次（间隔3小时）、6次（间隔2小时）用药时程:单次给药（D1）、每日4次给药（D2至D5）、每日6次给药（D6至D9），其中D2至D4期间每天给药4次（两次给药间隔3小时）、D5的早晨右眼给药1次，D6至D8期间每天给药6次（两次给药间隔2小时）、D9的早晨右眼给药1次。,1中文通用名:VVN461滴眼液安慰剂英文通用名:VVN461OphthalmicSolutionPlacebo商品:NA剂型:滴眼剂规格:0%（0.4ml:0mg)用量:单次：右眼滴入一滴多剂QID和Q2h：每次右眼滴入一滴，每日4次（间隔3小时）、6次（间隔2小时）用药时程:单次给药（D1）、每日4次给药（D2至D5）、每日6次给药（D6至D9），其中D2至D4期间每天给药4次（两次给药间隔3小时）、D5的早晨右眼给药1次，D6至D8期间每天给药6次（两次给药间隔2小时）、D9的早晨右眼给药1次。,VVN461-CCS-101,,,2022-10-25,否,平行分组,随机化,双盲,有,无,有,国内试验
CTR20230437,进行中,进行中（尚未招募）,曹亚玲,石家庄龙泽制药股份有限公司,2023-02-15,,艾司奥美拉唑镁肠溶片,,化学药物,,胃食管反流病（GERD）；与适当的抗菌疗法联合用药根除幽门螺杆菌，并且需要持续NSAID治疗的患者。,其它其他说明:生物等效性试验,,生物等效性试验/生物利用度试验,国内试验,18岁(最小年龄)至无上限(最大年龄),男+女,国内:61；,国内:登记人暂未填写该信息；,国内:登记人暂未填写该信息；,1男女均可，女性处于非妊娠且非哺乳期；2年龄≥18周岁（包含临界值）的健康受试者；3体重指数（BMI）＝体重（kg）/身高2（m2），体重指数在18.0~27.9kg/m2范围内（包括临界值）；男性受试者体重≥50.0kg，女性受试者体重≥45.0kg；4自愿参加并签署知情同意书者；获得知情同意书过程符合GCP；5女性受试者同意保证在给药前2周（男性受试者自第一次给药后）至最后一次研究药物给药后3个月内使用有效的非药物方式进行适当的避孕，且无捐卵（男性捐精）计划者。,1体格检查、生命体征检查及血常规、血生化、凝血功能、女性血妊娠、尿常规、12-导联心电图、HBsAg、HCV抗体、HIV抗体、梅毒筛查、药物滥用筛查等检查异常且具有临床意义；2有心血管、内分泌、神经、呼吸、泌尿、免疫系统及消化系统（有溃疡或消化道出血者等患者）等严重疾病史或现有上述系统疾病者，尤其是间质性肾炎、皮肤红斑狼疮、系统性红斑狼疮病史，既往有严重过敏反应病史，且研究医生认为不适合参加临床试验；3对两种或以上药物、食物过敏；或易发生哮喘、皮疹、荨麻疹等；或已知对艾司奥美拉唑及其辅料或取代的苯并咪唑类药物有过敏史；4有精神疾病史、药物滥用史、药物依赖史；5在服用研究药物前14天内使用了任何处方药、非处方药、中草药或保健品（使用外用制剂或局部用药制剂除外）；6试验前3个月内平均每日吸烟量多于5支；7不能耐受静脉穿刺采血；8有吸毒和/或酗酒史（每周饮酒超过14单位酒精，1单位=360mL啤酒或45mL酒精量为40%的烈酒或150mL葡萄酒）；9在服用研究药物前三个月内献血或大量失血（超过200mL）；10试验前3个月内每天饮用过量茶、咖啡或含咖啡因的饮料（8杯以上，1杯=250mL）；11试验前3个月内参加了任何药物临床试验并使用了任何临床试验药物；12在研究前筛选阶段或分配试验号前发生急性疾病；13对饮食有特殊要求，不能遵守统一饮食；14在服用研究药物前24小时内服用过任何含酒精的制品或酒精呼气检查结果呈阳性；15在服用研究药物前7天内服用过特殊饮食或其他影响药物吸收、分布、代谢、排泄等因素的饮食（如西柚、葡萄柚、芒果、火龙果、葡萄汁、橙汁等含有丰富黄酮类或柑橘苷类化合物）；16研究首次用药前30天内使用过CYP2C19或CYP3A4有关药物(如伏立康唑)，抗菌药（克拉霉素）等任何与艾司奥美拉唑镁肠溶片体内处置有关的药物；17乳糖或糖耐受不良（曾发生过喝牛奶腹泻者）、葡萄糖-半乳糖吸收障碍或蔗糖酶-异麦芽糖酶不足者；18受试者主动退出或研究者判断不适宜参加。,国内：登记人暂未填写该信息；,国内：登记人暂未填写该信息；,国内：登记人暂未填写该信息；,主要目的：本研究以石家庄龙泽制药股份有限公司研发的艾司奥美拉唑镁肠溶片（规格：20mg）为受试制剂，按生物等效性研究的有关规定，以原研厂家阿斯利康制药有限公司生产的艾司奥美拉唑镁肠溶片（规格：20mg，商品名：耐信®）为参比制剂，评估受试制剂和参比制剂在空腹/餐后条件下给药后的生物等效性。次要目的：观察受试制剂艾司奥美拉唑镁肠溶片和参比制剂艾司奥美拉唑镁肠溶片（耐信®）在健康受试者中的安全性。,艾司奥美拉唑镁肠溶片（20mg）健康人体生物等效性研究,艾司奥美拉唑镁肠溶片（20mg）健康人体生物等效性研究,1中文通用名:艾司奥美拉唑镁肠溶片英文通用名:EsomeprazoleMagnesiumEnteric-coatedTablets商品:NA剂型:片剂规格:20mg用量:口服，每周期单次给药1片，20mg，240ml水送服用药时程:空腹试验：单次给药，共给药2个周期；餐后试验：单次给药，共给药3个周期。,1中文通用名:艾司奥美拉唑镁肠溶片英文通用名:EsomeprazoleMagnesiumEnteric-coatedTablets商品:耐信剂型:片剂规格:20mg用量:口服，每周期单次给药1片，20mg，240ml水送服用药时程:空腹试验：单次给药，共给药2个周期；餐后试验：单次给药，共给药3个周期,C22LBE019,,,2022-12-08,否,交叉设计,随机化,开放,有,无,无,国内试验
